<?xml version="1.0" encoding="utf-8" ?>
<!DOCTYPE Persons SYSTEM "persons.dtd">
<Persons>
    <Person id="1" name="Alex">
        <Email>aa@tu.by</Email>
        <Nickname>aa</Nickname>
        <Password>aa</Password>
        <Ads>
            <Ad>
                <Description>
                    Хорошая квартира
                </Description>
                <Adres>
                    г.Минск
                </Adres>
                <Floor>3</Floor>
                <Floors>5</Floors>
                <Square>48.6</Square>
            </Ad>
            <Ad>
                <Description>
                    Квартира
                </Description>
                <Adres>
                    г.Минск
                </Adres>
                <Floor>3</Floor>
                <Floors>5</Floors>
                <Square>48.6</Square>
            </Ad>
        </Ads>
    </Person>
</Persons>